{
  "id": "rec_01",
  "decision_id": "dec_01",
  "factura_id": "f_01",
  "hash_documento": "a3f1c2d4e5b60718293a4b5c6d7e8f90a1b2c3d4e5f60718293a4b5c6d7e8f90",
  "beneficiario_id": "prov_andino",
  "monto_menor": "600000000",
  "moneda": "COP",
  "monto_base_menor": "150000",
  "veredicto": "PAGAR",
  "modo_autonomia": "autonomo",
  "reglas": [
    {
      "id": "R1",
      "estado": "cumple"
    },
    {
      "id": "R9",
      "estado": "cumple"
    }
  ],
  "fallas_aprobadas": [],
  "mandato_version": "v2",
  "nonce": "n_9f3c1a7b2d",
  "emitido_en": "2026-10-12T14:02:12Z",
  "vence_en": "2026-10-13T14:02:12Z",
  "clave_version": "k1",
  "firma": "MEUCIQ..."
}
